{"cell": "5 km hexagon, EPSG:3577", "cells": [{"id": 6, "lat": -41.2050, "lon": 144.7129, "weight": 0.002028, "records": 4, "recording_hot_spot": false}, {"id": 8, "lat": -41.0465, "lon": 144.6928, "weight": 0.010142, "records": 20, "recording_hot_spot": false}, {"id": 9, "lat": -40.9674, "lon": 144.6828, "weight": 0.002028, "records": 4, "recording_hot_spot": false}, {"id": 11, "lat": -40.8091, "lon": 144.6629, "weight": 0.000507, "records": 1, "recording_hot_spot": false}, {"id": 12, "lat": -41.6346, "lon": 144.8558, "weight": 0.000507, "records": 1, "recording_hot_spot": false}, {"id": 17, "lat": -41.2378, "lon": 144.8050, "weight": 0.000507, "records": 1, "recording_hot_spot": false}, {"id": 18, "lat": -41.1585, "lon": 144.7949, "weight": 0.000507, "records": 1, "recording_hot_spot": false}, {"id": 19, "lat": -41.0793, "lon": 144.7848, "weight": 0.000507, "records": 1, "recording_hot_spot": false}, {"id": 21, "lat": -40.9209, "lon": 144.7647, "weight": 0.000507, "records": 1, "recording_hot_spot": false}, {"id": 22, "lat": -40.8418, "lon": 144.7546, "weight": 0.002028, "records": 4, "recording_hot_spot": true}, {"id": 23, "lat": -40.7627, "lon": 144.7446, "weight": 0.011663, "records": 23, "recording_hot_spot": true}, {"id": 24, "lat": -40.6836, "lon": 144.7346, "weight": 0.027383, "records": 54, "recording_hot_spot": true}, {"id": 33, "lat": -41.1120, "lon": 144.8769, "weight": 0.001014, "records": 2, "recording_hot_spot": false}, {"id": 34, "lat": -41.0328, "lon": 144.8667, "weight": 0.000507, "records": 1, "recording_hot_spot": false}, {"id": 35, "lat": -40.9536, "lon": 144.8566, "weight": 0.001014, "records": 2, "recording_hot_spot": false}, {"id": 36, "lat": -40.8745, "lon": 144.8465, "weight": 0.000507, "records": 1, "recording_hot_spot": true}, {"id": 37, "lat": -40.7953, "lon": 144.8364, "weight": 0.006592, "records": 13, "recording_hot_spot": true}, {"id": 39, "lat": -41.8590, "lon": 145.0618, "weight": 0.001521, "records": 3, "recording_hot_spot": false}, {"id": 40, "lat": -41.7795, "lon": 145.0514, "weight": 0.021805, "records": 43, "recording_hot_spot": false}, {"id": 41, "lat": -41.7000, "lon": 145.0411, "weight": 0.000507, "records": 1, "recording_hot_spot": false}, {"id": 46, "lat": -41.3032, "lon": 144.9895, "weight": 0.000507, "records": 1, "recording_hot_spot": false}, {"id": 48, "lat": -41.1446, "lon": 144.9690, "weight": 0.003550, "records": 7, "recording_hot_spot": false}, {"id": 49, "lat": -41.0654, "lon": 144.9588, "weight": 0.002028, "records": 4, "recording_hot_spot": false}, {"id": 50, "lat": -40.9862, "lon": 144.9486, "weight": 0.000507, "records": 1, "recording_hot_spot": false}, {"id": 51, "lat": -40.9071, "lon": 144.9384, "weight": 0.001014, "records": 2, "recording_hot_spot": false}, {"id": 52, "lat": -40.8280, "lon": 144.9282, "weight": 0.002535, "records": 5, "recording_hot_spot": false}, {"id": 53, "lat": -40.7489, "lon": 144.9180, "weight": 0.000507, "records": 1, "recording_hot_spot": false}, {"id": 54, "lat": -42.6088, "lon": 145.2495, "weight": 0.000507, "records": 1, "recording_hot_spot": false}, {"id": 57, "lat": -42.3695, "lon": 145.2177, "weight": 0.003043, "records": 6, "recording_hot_spot": false}, {"id": 58, "lat": -42.2897, "lon": 145.2072, "weight": 0.000507, "records": 1, "recording_hot_spot": false}, {"id": 59, "lat": -42.2101, "lon": 145.1966, "weight": 0.002028, "records": 4, "recording_hot_spot": false}, {"id": 64, "lat": -41.6532, "lon": 145.1233, "weight": 0.000507, "records": 1, "recording_hot_spot": false}, {"id": 70, "lat": -41.1772, "lon": 145.0612, "weight": 0.000507, "records": 1, "recording_hot_spot": false}, {"id": 73, "lat": -40.9397, "lon": 145.0303, "weight": 0.000507, "records": 1, "recording_hot_spot": false}, {"id": 75, "lat": -40.7814, "lon": 145.0098, "weight": 0.000507, "records": 1, "recording_hot_spot": false}, {"id": 85, "lat": -42.0834, "lon": 145.2687, "weight": 0.000507, "records": 1, "recording_hot_spot": false}, {"id": 86, "lat": -42.0038, "lon": 145.2581, "weight": 0.001014, "records": 2, "recording_hot_spot": false}, {"id": 91, "lat": -41.6064, "lon": 145.2056, "weight": 0.001014, "records": 2, "recording_hot_spot": false}, {"id": 96, "lat": -41.2098, "lon": 145.1534, "weight": 0.001014, "records": 2, "recording_hot_spot": false}, {"id": 97, "lat": -41.1306, "lon": 145.1430, "weight": 0.000507, "records": 1, "recording_hot_spot": false}, {"id": 100, "lat": -40.8931, "lon": 145.1120, "weight": 0.002028, "records": 4, "recording_hot_spot": false}, {"id": 101, "lat": -40.8140, "lon": 145.1017, "weight": 0.000507, "records": 1, "recording_hot_spot": false}, {"id": 117, "lat": -41.7184, "lon": 145.3088, "weight": 0.001014, "records": 2, "recording_hot_spot": false}, {"id": 120, "lat": -41.4802, "lon": 145.2772, "weight": 0.001014, "records": 2, "recording_hot_spot": false}, {"id": 121, "lat": -41.4009, "lon": 145.2667, "weight": 0.010142, "records": 20, "recording_hot_spot": false}, {"id": 122, "lat": -41.3216, "lon": 145.2562, "weight": 0.000507, "records": 1, "recording_hot_spot": false}, {"id": 124, "lat": -41.1631, "lon": 145.2352, "weight": 0.002028, "records": 4, "recording_hot_spot": false}, {"id": 125, "lat": -41.0839, "lon": 145.2248, "weight": 0.005071, "records": 10, "recording_hot_spot": false}, {"id": 126, "lat": -41.0047, "lon": 145.2144, "weight": 0.002028, "records": 4, "recording_hot_spot": false}, {"id": 144, "lat": -41.9099, "lon": 145.4229, "weight": 0.000507, "records": 1, "recording_hot_spot": false}, {"id": 145, "lat": -41.8304, "lon": 145.4123, "weight": 0.000507, "records": 1, "recording_hot_spot": false}, {"id": 153, "lat": -41.1955, "lon": 145.3275, "weight": 0.000507, "records": 1, "recording_hot_spot": false}, {"id": 154, "lat": -41.1163, "lon": 145.3170, "weight": 0.000507, "records": 1, "recording_hot_spot": false}, {"id": 155, "lat": -41.0371, "lon": 145.3065, "weight": 0.001014, "records": 2, "recording_hot_spot": true}, {"id": 156, "lat": -40.9580, "lon": 145.2960, "weight": 0.001014, "records": 2, "recording_hot_spot": false}, {"id": 169, "lat": -42.3404, "lon": 145.5699, "weight": 0.000507, "records": 1, "recording_hot_spot": false}, {"id": 172, "lat": -42.1015, "lon": 145.5375, "weight": 0.001014, "records": 2, "recording_hot_spot": false}, {"id": 177, "lat": -41.7039, "lon": 145.4838, "weight": 0.000507, "records": 1, "recording_hot_spot": false}, {"id": 184, "lat": -41.1487, "lon": 145.4093, "weight": 0.001014, "records": 2, "recording_hot_spot": false}, {"id": 185, "lat": -41.0695, "lon": 145.3987, "weight": 0.001014, "records": 2, "recording_hot_spot": false}, {"id": 186, "lat": -40.9904, "lon": 145.3881, "weight": 0.002535, "records": 5, "recording_hot_spot": false}, {"id": 187, "lat": -40.9112, "lon": 145.3776, "weight": 0.001521, "records": 3, "recording_hot_spot": false}, {"id": 203, "lat": -42.1339, "lon": 145.6307, "weight": 0.000507, "records": 1, "recording_hot_spot": false}, {"id": 208, "lat": -41.7363, "lon": 145.5766, "weight": 0.003043, "records": 6, "recording_hot_spot": false}, {"id": 209, "lat": -41.6569, "lon": 145.5659, "weight": 0.000507, "records": 1, "recording_hot_spot": false}, {"id": 210, "lat": -41.5775, "lon": 145.5551, "weight": 0.000507, "records": 1, "recording_hot_spot": false}, {"id": 211, "lat": -41.4981, "lon": 145.5444, "weight": 0.005071, "records": 10, "recording_hot_spot": false}, {"id": 212, "lat": -41.4188, "lon": 145.5336, "weight": 0.004564, "records": 9, "recording_hot_spot": true}, {"id": 213, "lat": -41.3395, "lon": 145.5229, "weight": 0.001521, "records": 3, "recording_hot_spot": false}, {"id": 214, "lat": -41.2603, "lon": 145.5123, "weight": 0.000507, "records": 1, "recording_hot_spot": false}, {"id": 215, "lat": -41.1811, "lon": 145.5016, "weight": 0.002535, "records": 5, "recording_hot_spot": true}, {"id": 216, "lat": -41.1019, "lon": 145.4909, "weight": 0.002028, "records": 4, "recording_hot_spot": true}, {"id": 219, "lat": -40.8645, "lon": 145.4591, "weight": 0.000507, "records": 1, "recording_hot_spot": false}, {"id": 235, "lat": -42.0867, "lon": 145.7131, "weight": 0.000507, "records": 1, "recording_hot_spot": false}, {"id": 242, "lat": -41.5305, "lon": 145.6371, "weight": 0.001014, "records": 2, "recording_hot_spot": false}, {"id": 243, "lat": -41.4512, "lon": 145.6263, "weight": 0.002535, "records": 5, "recording_hot_spot": true}, {"id": 244, "lat": -41.3719, "lon": 145.6155, "weight": 0.001014, "records": 2, "recording_hot_spot": true}, {"id": 245, "lat": -41.2926, "lon": 145.6047, "weight": 0.000507, "records": 1, "recording_hot_spot": false}, {"id": 246, "lat": -41.2134, "lon": 145.5940, "weight": 0.010649, "records": 21, "recording_hot_spot": true}, {"id": 247, "lat": -41.1342, "lon": 145.5832, "weight": 0.004564, "records": 9, "recording_hot_spot": true}, {"id": 248, "lat": -41.0550, "lon": 145.5725, "weight": 0.001521, "records": 3, "recording_hot_spot": false}, {"id": 269, "lat": -42.1190, "lon": 145.8064, "weight": 0.004564, "records": 9, "recording_hot_spot": false}, {"id": 277, "lat": -41.4834, "lon": 145.7189, "weight": 0.000507, "records": 1, "recording_hot_spot": false}, {"id": 278, "lat": -41.4041, "lon": 145.7081, "weight": 0.012170, "records": 24, "recording_hot_spot": true}, {"id": 280, "lat": -41.2456, "lon": 145.6864, "weight": 0.000507, "records": 1, "recording_hot_spot": false}, {"id": 281, "lat": -41.1664, "lon": 145.6756, "weight": 0.004564, "records": 9, "recording_hot_spot": true}, {"id": 284, "lat": -40.9290, "lon": 145.6433, "weight": 0.000507, "records": 1, "recording_hot_spot": false}, {"id": 302, "lat": -42.1513, "lon": 145.8997, "weight": 0.010142, "records": 20, "recording_hot_spot": false}, {"id": 311, "lat": -41.4363, "lon": 145.8007, "weight": 0.001014, "records": 2, "recording_hot_spot": false}, {"id": 312, "lat": -41.3571, "lon": 145.7898, "weight": 0.003043, "records": 6, "recording_hot_spot": false}, {"id": 314, "lat": -41.1986, "lon": 145.7680, "weight": 0.001521, "records": 3, "recording_hot_spot":